{
  "schema_version": "1.0.0",
  "session_id": "11111111-1111-4111-8111-111111111111",
  "trace_id": "22222222-2222-4222-8222-222222222222",
  "origin": "BEY",
  "destination": "IST",
  "depart_date": "2026-09-10",
  "return_date": "2026-09-13",
  "traveler_count": 2,
  "budget": { "amount_minor_units": 200000000, "currency": "TRY" },
  "preferences": {
    "schema_version": "1.0.0",
    "interests": ["history", "food"],
    "pace": "moderate",
    "language": "en",
    "mobility_constraints": []
  }
}
